RowId,Title,Year,Rated,Released,Runtime,Genre,Director,Writer,Actors,Plot,Language,Country,Awards,Poster,Ratings.Source,Ratings.Value,Metascore,imdbRating,imdbVotes,imdbID,Type,tomatoMeter,tomatoImage,tomatoRating,tomatoReviews,tomatoFresh,tomatoRotten,tomatoConsensus,tomatoUserMeter,tomatoUserRating,tomatoUserReviews,tomatoURL,DVD,BoxOffice,Production,Website,Response
135,The Secret in Their Eyes,2009,R,2010-05-21,129,Drama  Mystery  Romance,Juan José Campanella,Eduardo Sacheri (screenplay)  Juan José Campanella (screenplay)  Eduardo Sacheri (novel),Soledad Villamil  Ricardo Darín  Carla Quevedo  Pablo Rago,A retired legal counselor writes a novel hoping to find closure for one of his past unresolved homicide cases and for his unreciprocated love with his superior - both of which still haunt him decades later.,Spanish,Argentina  Spain,Won 1 Oscar. Another 51 wins & 40 nominations.,https://images-na.ssl-images-amazon.com/images/M/MV5BMTgwNTI3OTczOV5BMl5BanBnXkFtZTcwMTM3MTUyMw@@._V1_SX300.jpg,Internet Movie Database,8.2/10,80.0,8.2,145345,tt1305806,movie,,,,,,,,,,,http://www.rottentomatoes.com/m/secret_in_their_eyes/,2010-09-21,6390014.0,Sony Pictures Classics,http://www.sonyclassics.com/thesecretintheireyes/,True
136,Room,2015,R,2016-01-22,118,Drama,Lenny Abrahamson,Emma Donoghue (screenplay)  Emma Donoghue (novel),Brie Larson  Jacob Tremblay  Sean Bridgers  Wendy Crewson,A young boy is raised within the confines of a small shed.,English,Ireland  Canada  UK  USA,Won 1 Oscar. Another 102 wins & 132 nominations.,https://images-na.ssl-images-amazon.com/images/M/MV5BMjE4NzgzNzEwMl5BMl5BanBnXkFtZTgwMTMzMDE0NjE@._V1_SX300.jpg,Internet Movie Database,8.2/10,86.0,8.2,226372,tt3170832,movie,,,,,,,,,,,http://www.rottentomatoes.com/m/room_2015/,2016-03-01,14677654.0,Element Pictures,http://www.lahabitacion.com.ar/,True
137,The Bridge on the River Kwai,1957,PG,2057-12-14,161,Adventure  Drama  War,David Lean,Pierre Boulle (novel)  Carl Foreman (screenplay)  Michael Wilson (screenplay),William Holden  Alec Guinness  Jack Hawkins  Sessue Hayakawa,After settling his differences with a Japanese PoW camp commander  a British colonel co-operates to oversee his men's construction of a railway bridge for their captors - while oblivious to a plan by the Allies to destroy it.,English  Japanese  Thai,UK  USA,Won 7 Oscars. Another 23 wins & 7 nominations.,https://images-na.ssl-images-amazon.com/images/M/MV5BZTZmNjgyZmUtOTI2MC00MDI4LWJjOTgtNjc2YTc4YTk0ZWJjL2ltYWdlL2ltYWdlXkEyXkFqcGdeQXVyNjc1NTYyMjg@._V1_SX300.jpg,Internet Movie Database,8.2/10,,8.2,161564,tt0050212,movie,,,,,,,,,,,http://www.rottentomatoes.com/m/bridge_on_the_river_kwai/,2000-11-21,,Columbia Pictures,,True
138,Blade Runner,1982,R,1982-06-25,117,Sci-Fi  Thriller,Ridley Scott,Hampton Fancher (screenplay)  David Webb Peoples (screenplay)  Philip K. Dick (novel),Harrison Ford  Rutger Hauer  Sean Young  Edward James Olmos,A blade runner must pursue and try to terminate four replicants who stole a ship in space and have returned to Earth to find their creator.,English  German  Cantonese  Japanese  Hungarian,USA  Hong Kong  UK,Nominated for 2 Oscars. Another 11 wins & 16 nominations.,https://images-na.ssl-images-amazon.com/images/M/MV5BNzQzMzJhZTEtOWM4NS00MTdhLTg0YjgtMjM4MDRkZjUwZDBlXkEyXkFqcGdeQXVyNjU0OTQ0OTY@._V1_SX300.jpg,Internet Movie Database,8.2/10,89.0,8.2,499344,tt0083658,movie,,,,,,,,,,,http://www.rottentomatoes.com/m/blade_runner/,1997-08-27,,Warner Bros. Pictures,,True
139,Howl's Moving Castle,2004,PG,2005-06-17,119,Animation  Adventure  Family,Hayao Miyazaki,Hayao Miyazaki (screenplay)  Diana Wynne Jones (novel),Chieko Baishô  Takuya Kimura  Akihiro Miwa  Tatsuya Gashûin,When an unconfident young woman is cursed with an old body by a spiteful witch  her only chance of breaking the spell lies with a self-indulgent yet insecure young wizard and his companions in his legged  walking castle.,Japanese,Japan,Nominated for 1 Oscar. Another 15 wins & 19 nominations.,https://images-na.ssl-images-amazon.com/images/M/MV5BMTY1OTg0MjE3MV5BMl5BanBnXkFtZTcwNTUxMTkyMQ@@._V1_SX300.jpg,Internet Movie Database,8.2/10,80.0,8.2,236747,tt0347149,movie,,,,,,,,,,,http://www.rottentomatoes.com/m/howls_moving_castle/,2006-03-07,4520887.0,Buena Vista,http://www.howl-movie.com/,True
140,La La Land,2016,PG-13,2016-12-25,128,Comedy  Drama  Music,Damien Chazelle,Damien Chazelle,Ryan Gosling  Emma Stone  Amiée Conn  Terry Walters,A jazz pianist falls for an aspiring actress in Los Angeles.,English,USA,Won 6 Oscars. Another 197 wins & 243 nominations.,https://images-na.ssl-images-amazon.com/images/M/MV5BMzUzNDM2NzM2MV5BMl5BanBnXkFtZTgwNTM3NTg4OTE@._V1_SX300.jpg,Internet Movie Database,8.2/10,93.0,8.2,272059,tt3783958,movie,,,,,,,,,,,http://www.rottentomatoes.com/m/la_la_land/,2017-04-25,151058124.0,Liongate Films,http://www.lalaland.movie/,True
141,Incendies,2010,R,2011-01-12,131,Drama  Mystery  War,Denis Villeneuve,Denis Villeneuve (scenario)  Wajdi Mouawad (play)  Valérie Beaugrand-Champagne (collaboration)  Denis Villeneuve (dialogue),Mustafa Kamel  Hussein Sami  Rémy Girard  Mélissa Désormeaux-Poulin,Twins journey to the Middle East to discover their family history  and fulfill their mother's last wishes.,French  Arabic  English,Canada  France,Nominated for 1 Oscar. Another 39 wins & 15 nominations.,https://images-na.ssl-images-amazon.com/images/M/MV5BMjEyNTA3Njk4M15BMl5BanBnXkFtZTcwMzkzMzY3Mw@@._V1_SX300.jpg,Internet Movie Database,8.2/10,80.0,8.2,94067,tt1255953,movie,,,,,,,,,,,http://www.rottentomatoes.com/m/incendies/,2011-09-13,6857096.0,Sony Pictures Classics,http://www.sonyclassics.com/incendies,True
142,Judgment at Nuremberg,1961,NOT RATED,2061-12-18,186,Drama  War,Stanley Kramer,Abby Mann  Abby Mann (based on his original story by),Spencer Tracy  Burt Lancaster  Richard Widmark  Marlene Dietrich,In 1948  an American court in occupied Germany tries four Nazi judges for war crimes.,English  German,USA,Won 2 Oscars. Another 13 wins & 25 nominations.,https://images-na.ssl-images-amazon.com/images/M/MV5BNDc2ODQ5NTE2MV5BMl5BanBnXkFtZTcwODExMjUyNA@@._V1_SX300.jpg,Internet Movie Database,8.3/10,,8.3,49303,tt0055031,movie,,,,,,,,,,,http://www.rottentomatoes.com/m/judgment_at_nuremburg/,2004-09-07,,United Artists,,True
143,The Seventh Seal,1957,NOT RATED,2058-10-13,96,Drama  Fantasy,Ingmar Bergman,Ingmar Bergman (play)  Ingmar Bergman (screenplay),Gunnar Björnstrand  Bengt Ekerot  Nils Poppe  Max von Sydow,A man seeks answers about life  death  and the existence of God as he plays chess against the Grim Reaper during the Black Plague.,Swedish  Latin,Sweden,7 wins & 1 nomination.,https://images-na.ssl-images-amazon.com/images/M/MV5BM2I1ZWU4YjMtYzU0My00YmMzLWFmNTAtZDJhZGYwMmI3YWQ5XkEyXkFqcGdeQXVyNjU0OTQ0OTY@._V1_SX300.jpg,Internet Movie Database,8.2/10,,8.2,121318,tt0050976,movie,,,,,,,,,,,http://www.rottentomatoes.com/m/seventh_seal/,2009-11-17,,Janus Films,,True
144,Lock  Stock and Two Smoking Barrels,1998,R,1998-08-28,107,Comedy  Crime,Guy Ritchie,Guy Ritchie,Jason Flemyng  Dexter Fletcher  Nick Moran  Jason Statham,A botched card game in London triggers four friends  thugs  weed-growers  hard gangsters  loan sharks and debt collectors to collide with each other in a series of unexpected events  all for the sake of weed  cash and two antique shotguns.,English,UK,Nominated for 1 BAFTA Film Award. Another 13 wins & 7 nominations.,https://images-na.ssl-images-amazon.com/images/M/MV5BMTAyN2JmZmEtNjAyMy00NzYwLThmY2MtYWQ3OGNhNjExMmM4XkEyXkFqcGdeQXVyNDk3NzU2MTQ@._V1_SX300.jpg,Internet Movie Database,8.2/10,66.0,8.2,442704,tt0120735,movie,,,,,,,,,,,http://www.rottentomatoes.com/m/lock_stock_and_two_smoking_barrels/,1999-08-31,,Gramercy Pictures,,True
145,Mr. Smith Goes to Washington,1939,NOT RATED,2039-10-19,129,Comedy  Drama,Frank Capra,Sidney Buchman (screen play)  Lewis R. Foster (story),Jean Arthur  James Stewart  Claude Rains  Edward Arnold,A naive man is appointed to fill a vacancy in the United States Senate. His plans promptly collide with political corruption  but he doesn't back down.,English,USA,Won 1 Oscar. Another 4 wins & 11 nominations.,https://images-na.ssl-images-amazon.com/images/M/MV5BZTYwYjYxYzgtMDE1Ni00NzU4LWJlMTEtODQ5YmJmMGJhZjI5L2ltYWdlXkEyXkFqcGdeQXVyMDI2NDg0NQ@@._V1_SX300.jpg,Internet Movie Database,8.2/10,,8.2,83328,tt0031679,movie,,,,,,,,,,,http://www.rottentomatoes.com/m/can_mr_smith_get_to_washington_anymore/,2007-08-21,,ITVS,http://www.mrsmithmovie.com/,True
146,Casino,1995,R,1995-11-22,178,Crime  Drama,Martin Scorsese,Nicholas Pileggi (book)  Nicholas Pileggi (screenplay)  Martin Scorsese (screenplay),Robert De Niro  Sharon Stone  Joe Pesci  James Woods,Greed  deception  money  power  and murder occur between two best friends: a mafia underboss and a casino owner  for a trophy wife over a gambling empire.,English,France  USA,Nominated for 1 Oscar. Another 3 wins & 9 nominations.,https://images-na.ssl-images-amazon.com/images/M/MV5BMTcxOWYzNDYtYmM4YS00N2NkLTk0NTAtNjg1ODgwZjAxYzI3XkEyXkFqcGdeQXVyNTA4NzY1MzY@._V1_SX300.jpg,Internet Movie Database,8.2/10,73.0,8.2,360941,tt0112641,movie,,,,,,,,,,,http://www.rottentomatoes.com/m/1067987-casino/,1998-02-24,,Universal Pictures,,True
147,A Beautiful Mind,2001,PG-13,2002-01-04,135,Biography  Drama,Ron Howard,Akiva Goldsman  Sylvia Nasar (book),Russell Crowe  Ed Harris  Jennifer Connelly  Christopher Plummer,After John Nash  a brilliant but asocial mathematician  accepts secret work in cryptography  his life takes a turn for the nightmarish.,English,USA,Won 4 Oscars. Another 33 wins & 65 nominations.,https://images-na.ssl-images-amazon.com/images/M/MV5BMzcwYWFkYzktZjAzNC00OGY1LWI4YTgtNzc5MzVjMDVmNjY0XkEyXkFqcGdeQXVyMTQxNzMzNDI@._V1_SX300.jpg,Internet Movie Database,8.2/10,72.0,8.2,667901,tt0268978,movie,,,,,,,,,,,http://www.rottentomatoes.com/m/beautiful_mind/,2002-06-25,,Universal Pictures,http://www.abeautifulmind.com,True
148,Logan,2017,R,2017-03-03,137,Action  Drama  Sci-Fi,James Mangold,James Mangold (story by)  Scott Frank (screenplay)  James Mangold (screenplay)  Michael Green (screenplay),Hugh Jackman  Patrick Stewart  Dafne Keen  Boyd Holbrook,In the near future  a weary Logan cares for an ailing Professor X somewhere on the Mexican border. However  Logan's attempts to hide from the world and his legacy are upended when a young mutant arrives  pursued by dark forces.,English  Spanish,USA  Canada  Australia,1 win & 2 nominations.,https://images-na.ssl-images-amazon.com/images/M/MV5BMjQwODQwNTg4OV5BMl5BanBnXkFtZTgwMTk4MTAzMjI@._V1_SX300.jpg,Internet Movie Database,8.3/10,77.0,8.3,316354,tt3315342,movie,,,,,,,,,,,https://www.rottentomatoes.com/m/logan_2017,2017-05-23,226252579.0,20th Century Fox,http://www.foxmovies.com/movies/logan,True
149,The Elephant Man,1980,PG,1980-10-10,124,Biography  Drama,David Lynch,"Christopher De Vore (screenplay)  Eric Bergren (screenplay)  David Lynch (screenplay)  Frederick Treves (book)  Ashley Montagu (in part on the book ""The Elephant Man: A Study in Human Dignity"")",Anthony Hopkins  John Hurt  Anne Bancroft  John Gielgud,A Victorian surgeon rescues a heavily disfigured man who is mistreated while scraping a living as a side-show freak. Behind his monstrous facade  there is revealed a person of intelligence and sensitivity.,English,USA  UK,Nominated for 8 Oscars. Another 10 wins & 14 nominations.,https://images-na.ssl-images-amazon.com/images/M/MV5BMDVjNjIwOGItNDE3Ny00OThjLWE0NzQtZTU3YjMzZTZjMzhkXkEyXkFqcGdeQXVyMTQxNzMzNDI@._V1_SX300.jpg,Internet Movie Database,8.2/10,,8.2,174583,tt0080678,movie,,,,,,,,,,,http://www.rottentomatoes.com/m/1006527-elephant_man/,2001-12-11,,Paramount,,True
150,Andrei Rublev,1966,NOT RATED,,205,Biography  Drama  History,Andrei Tarkovsky,Andrey Konchalovskiy  Andrei Tarkovsky,Anatoliy Solonitsyn  Ivan Lapikov  Nikolay Grinko  Nikolay Sergeev,The life  times and afflictions of the fifteenth-century Russian iconographer.,Russian  Italian  Tatar,Soviet Union,3 wins.,https://images-na.ssl-images-amazon.com/images/M/MV5BMjhkN2Q3MzctNzJiOC00OTc5LWIwOWYtNWRiYWUyMDk0MGZiXkEyXkFqcGdeQXVyNTAyODkwOQ@@._V1_SX300.jpg,Internet Movie Database,8.3/10,,8.3,26621,tt0060107,movie,,,,,,,,,,,http://www.rottentomatoes.com/m/andrei_rublev/,1999-02-02,,Criterion Collection,,True
151,Wild Strawberries,1957,UNRATED,2059-06-22,91,Drama  Romance,Ingmar Bergman,Ingmar Bergman,Victor Sjöström  Bibi Andersson  Ingrid Thulin  Gunnar Björnstrand,After living a life marked by coldness  an aging professor is forced to confront the emptiness of his existence.,Swedish  Latin,Sweden,Nominated for 1 Oscar. Another 16 wins & 2 nominations.,https://images-na.ssl-images-amazon.com/images/M/MV5BMjgwNjI3NTM1MF5BMl5BanBnXkFtZTgwNzY3MTUyMjE@._V1_SX300.jpg,Internet Movie Database,8.2/10,,8.2,68660,tt0050986,movie,,,,,,,,,,,http://www.rottentomatoes.com/m/wild_strawberries/,2002-02-12,,Janus Films,,True
152,V for Vendetta,2005,R,2006-03-17,132,Action  Drama  Thriller,James McTeigue,Lilly Wachowski (screenplay)  Lana Wachowski (screenplay)  David Lloyd (graphic novel art),Natalie Portman  Hugo Weaving  Stephen Rea  Stephen Fry,"In a future British tyranny  a shadowy freedom fighter  known only by the alias of ""V""  plots to overthrow it with the help of a young woman.",English,USA  UK  Germany,7 wins & 27 nominations.,https://images-na.ssl-images-amazon.com/images/M/MV5BYzllMjJkODAtYjMwMi00YmNhLWFhYzAtZjZjODg5YzEwOGUwXkEyXkFqcGdeQXVyNjU0OTQ0OTY@._V1_SX300.jpg,Internet Movie Database,8.2/10,62.0,8.2,849623,tt0434409,movie,,,,,,,,,,,http://www.rottentomatoes.com/m/v_for_vendetta/,2006-08-01,70500000.0,Warner Bros. Pictures,http://vforvendetta.warnerbros.com/,True
153,The General,1926,UNRATED,2027-02-24,67,Action  Adventure  Comedy,Clyde Bruckman  Buster Keaton,Buster Keaton  Clyde Bruckman  Al Boasberg (adapted by)  Charles Henry Smith (adapted by),Buster Keaton  Marion Mack  Glen Cavender  Jim Farley,When Union spies steal an engineer's beloved locomotive  he pursues it single-handedly and straight through enemy lines.,English,USA,2 wins & 1 nomination.,https://images-na.ssl-images-amazon.com/images/M/MV5BODQxMzMyNTY5Nl5BMl5BanBnXkFtZTcwMDMyNTk3OA@@._V1_SX300.jpg,Internet Movie Database,8.2/10,,8.2,58327,tt0017925,movie,,,,,,,,,,,http://www.rottentomatoes.com/m/1008166-general/,1999-10-26,,United Artists Films,,True
154,The Wolf of Wall Street,2013,R,2013-12-25,180,Biography  Comedy  Crime,Martin Scorsese,Terence Winter (screenplay)  Jordan Belfort (book),Leonardo DiCaprio  Jonah Hill  Margot Robbie  Matthew McConaughey,Based on the true story of Jordan Belfort  from his rise to a wealthy stock-broker living the high life to his fall involving crime  corruption and the federal government.,English  French,USA,Nominated for 5 Oscars. Another 38 wins & 165 nominations.,https://images-na.ssl-images-amazon.com/images/M/MV5BMjIxMjgxNTk0MF5BMl5BanBnXkFtZTgwNjIyOTg2MDE@._V1_SX300.jpg,Internet Movie Database,8.2/10,75.0,8.2,874371,tt0993846,movie,,,,,,,,,,,http://www.rottentomatoes.com/m/the_wolf_of_wall_street_2013/,2014-03-25,91330760.0,Paramount Studios,http://www.thewolfofwallstreet.com/,True
155,Warrior,2011,PG-13,2011-09-09,140,Action  Drama  Sport,Gavin O'Connor,Gavin O'Connor (screenplay)  Anthony Tambakis (screenplay)  Cliff Dorfman (screenplay)  Gavin O'Connor (story)  Cliff Dorfman (story),Joel Edgerton  Tom Hardy  Nick Nolte  Jennifer Morrison,The youngest son of an alcoholic former boxer returns home  where he's trained by his father for competition in a mixed martial arts tournament - a path that puts the fighter on a collision course with his estranged  older brother.,English  Spanish,USA,Nominated for 1 Oscar. Another 6 wins & 20 nominations.,https://images-na.ssl-images-amazon.com/images/M/MV5BMTk4ODk5MTMyNV5BMl5BanBnXkFtZTcwMDMyNTg0Ng@@._V1_SX300.jpg,Internet Movie Database,8.2/10,71.0,8.2,358261,tt1291584,movie,,,,,,,,,,,http://www.rottentomatoes.com/m/1212910-warrior/,2011-12-20,13600000.0,Lionsgate,http://www.WarriorFilm.com,True
156,The Bandit,1996,,1996-11-29,128,Crime  Drama  Thriller,Yavuz Turgul,Yavuz Turgul,Sener Sen  Ugur Yücel  Sermin Hürmeriç  Yesim Salkim,The epic adventures of the legendary Baran the Bandit following his release from prison. After serving 35 years  it is no surprise that the world has changed dramatically. Still  Baran ...,Turkish,Turkey  France  Bulgaria,2 wins.,https://images-na.ssl-images-amazon.com/images/M/MV5BOGQ4ZjFmYjktOGNkNS00OWYyLWIyZjgtMGJjM2U1ZTA0ZTlhXkEyXkFqcGdeQXVyNTA4NzY1MzY@._V1_SX300.jpg,Internet Movie Database,8.4/10,,8.4,41769,tt0116231,movie,,,,,,,,,,,http://www.rottentomatoes.com/m/the_bandit_1996/,,,,,True
157,Trainspotting,1996,R,1996-08-09,94,Drama,Danny Boyle,John Hodge (screenplay)  Irvine Welsh (novel),Ewan McGregor  Ewen Bremner  Jonny Lee Miller  Kevin McKidd,Renton  deeply immersed in the Edinburgh drug scene  tries to clean up and get out  despite the allure of the drugs and influence of friends.,English,UK,Nominated for 1 Oscar. Another 23 wins & 32 nominations.,https://images-na.ssl-images-amazon.com/images/M/MV5BMzA5Zjc3ZTMtMmU5YS00YTMwLWI4MWUtYTU0YTVmNjVmODZhXkEyXkFqcGdeQXVyNjU0OTQ0OTY@._V1_SX300.jpg,Internet Movie Database,8.2/10,83.0,8.2,517568,tt0117951,movie,,,,,,,,,,,http://www.rottentomatoes.com/m/trainspotting/,1998-03-24,,Miramax Films,http://www.miramax.com/movie/trainspotting/,True
158,Sunrise,1927,NOT RATED,2027-11-04,94,Drama  Romance,F.W. Murnau,Carl Mayer (scenario)  Hermann Sudermann (from an original theme by)  Katherine Hilliker (titles)  H.H. Caldwell (titles),George O'Brien  Janet Gaynor  Margaret Livingston  Bodil Rosing,An allegorical tale about a man fighting the good and evil within him. Both sides are made flesh - one a sophisticated woman he is attracted to and the other his wife.,,USA,Won 3 Oscars. Another 2 wins & 2 nominations.,https://images-na.ssl-images-amazon.com/images/M/MV5BOWQ1YmJkODYtMTJmYi00ZjczLWEyYWYtNWMzYTA3OWU2NmI2XkEyXkFqcGdeQXVyNTA4NzY1MzY@._V1_SX300.jpg,Internet Movie Database,8.3/10,,8.3,32667,tt0018455,movie,,,,,,,,,,,http://www.rottentomatoes.com/m/sunrise/,2008-12-09,,Fox Films,,True
159,Dial M for Murder,1954,PG,2054-05-29,105,Crime  Film-Noir  Thriller,Alfred Hitchcock,Frederick Knott (screen play)  Frederick Knott (adapted from his play),Ray Milland  Grace Kelly  Robert Cummings  John Williams,An ex-tennis pro carries out a plot to murder his wife. When things go wrong  he improvises a brilliant plan B.,English,USA,Nominated for 1 BAFTA Film Award. Another 3 wins & 2 nominations.,https://images-na.ssl-images-amazon.com/images/M/MV5BOWIwODIxYWItZDI4MS00YzhhLWE3MmYtMzlhZDIwOTMzZmE5L2ltYWdlXkEyXkFqcGdeQXVyNjc1NTYyMjg@._V1_SX300.jpg,Internet Movie Database,8.2/10,,8.2,116207,tt0046912,movie,,,,,,,,,,,http://www.rottentomatoes.com/m/dial_m_for_murder/,2004-09-07,,Warner Bros. Pictures,,True
160,Gran Torino,2008,R,2009-01-09,116,Drama,Clint Eastwood,Nick Schenk (screenplay)  Dave Johannson (story)  Nick Schenk (story),Clint Eastwood  Christopher Carley  Bee Vang  Ahney Her,Disgruntled Korean War veteran Walt Kowalski sets out to reform his neighbor  a Hmong teenager who tried to steal Kowalski's prized possession: a 1972 Gran Torino.,English  Hmong,Germany  USA,Nominated for 1 Golden Globe. Another 20 wins & 17 nominations.,https://images-na.ssl-images-amazon.com/images/M/MV5BMTQyMTczMTAxMl5BMl5BanBnXkFtZTcwOTc1ODE0Mg@@._V1_SX300.jpg,Internet Movie Database,8.2/10,72.0,8.2,598907,tt1205489,movie,,,,,,,,,,,http://www.rottentomatoes.com/m/gran_torino/,2009-06-09,148055047.0,Warner Bros. Pictures/Village Roadshow,http://www.thegrantorino.com/,True
161,The Deer Hunter,1978,R,1979-02-23,183,Drama  War,Michael Cimino,Michael Cimino (story)  Deric Washburn (story)  Louis Garfinkle (story)  Quinn K. Redeker (story)  Deric Washburn (screenplay),Robert De Niro  John Cazale  John Savage  Christopher Walken,An in-depth examination of the ways in which the U.S. Vietnam War impacts and disrupts the lives of people in a small industrial town in Pennsylvania.,English  Russian  Vietnamese  French,USA  UK,Won 5 Oscars. Another 17 wins & 26 nominations.,https://images-na.ssl-images-amazon.com/images/M/MV5BNjMxZWIyYzQtNjYzNy00NTk1LTg3ZDEtZDRmZmMxYmY4YmVjXkEyXkFqcGdeQXVyNjU0OTQ0OTY@._V1_SX300.jpg,Internet Movie Database,8.2/10,81.0,8.2,249067,tt0077416,movie,,,,,,,,,,,http://www.rottentomatoes.com/m/deer_hunter/,2005-09-06,,Universal Pictures,,True
162,Hacksaw Ridge,2016,R,2016-11-04,139,Biography  Drama  History,Mel Gibson,Robert Schenkkan (screenplay)  Andrew Knight (screenplay),Andrew Garfield  Richard Pyros  Jacob Warner  Milo Gibson,WWII American Army Medic Desmond T. Doss  who served during the Battle of Okinawa  refuses to kill people  and becomes the first man in American history to receive the Medal of Honor without firing a shot.,English  Japanese,Australia  USA,Won 2 Oscars. Another 37 wins & 95 nominations.,https://images-na.ssl-images-amazon.com/images/M/MV5BMjQ1NjM3MTUxNV5BMl5BanBnXkFtZTgwMDc5MTY5OTE@._V1_SX300.jpg,Internet Movie Database,8.2/10,71.0,8.2,221901,tt2119532,movie,,,,,,,,,,,http://www.rottentomatoes.com/m/hacksaw_ridge/,2017-02-21,67115062.0,Summit Entertainment,http://www.hacksawridge.movie/,True
163,Gone with the Wind,1939,G,2040-01-17,238,Drama  History  Romance,Victor Fleming  George Cukor  Sam Wood,"Margaret Mitchell (story of the old south ""Gone with the Wind"")  Sidney Howard (screenplay)",Thomas Mitchell  Barbara O'Neil  Vivien Leigh  Evelyn Keyes,A manipulative woman and a roguish man conduct a turbulent romance during the American Civil War and Reconstruction periods.,English,USA,Won 8 Oscars. Another 10 wins & 9 nominations.,https://images-na.ssl-images-amazon.com/images/M/MV5BYWQwOWVkMGItMDU2Yy00YjIzLWJkMjEtNmVkZjE3MjMwYzEzXkEyXkFqcGdeQXVyNjU0OTQ0OTY@._V1_SX300.jpg,Internet Movie Database,8.2/10,97.0,8.2,230951,tt0031381,movie,,,,,,,,,,,http://www.rottentomatoes.com/m/gone_with_the_wind/,2000-03-07,,Loew's Inc.,http://warnervideo.com/gonewiththewind/,True
164,Fargo,1996,R,1996-04-05,98,Crime  Drama  Thriller,Joel Coen  Ethan Coen,Ethan Coen  Joel Coen,William H. Macy  Steve Buscemi  Peter Stormare  Kristin Rudrüd,Jerry Lundegaard's inept crime falls apart due to his and his henchmen's bungling and the persistent police work of the quite pregnant Marge Gunderson.,English,USA  UK,Won 2 Oscars. Another 79 wins & 59 nominations.,https://images-na.ssl-images-amazon.com/images/M/MV5BMTgxNzY3MzUxOV5BMl5BanBnXkFtZTcwMDA0NjMyNA@@._V1_SX300.jpg,Internet Movie Database,8.1/10,85.0,8.1,490860,tt0116282,movie,,,,,,,,,,,http://www.rottentomatoes.com/m/fargo/,1997-06-24,,MGM,http://www.mgm.com/title_title.do?title_star=FARGO,True
165,The Big Lebowski,1998,R,1998-03-06,117,Comedy  Crime,Joel Coen  Ethan Coen,Ethan Coen  Joel Coen,Jeff Bridges  John Goodman  Julianne Moore  Steve Buscemi,"""The Dude"" Lebowski  mistaken for a millionaire Lebowski  seeks restitution for his ruined rug and enlists his bowling buddies to help get it.",English  German  Hebrew  Spanish,USA  UK,4 wins & 17 nominations.,https://images-na.ssl-images-amazon.com/images/M/MV5BZTFjMjBiYzItNzU5YS00MjdiLWJkOTktNDQ3MTE3ZjY2YTY5XkEyXkFqcGdeQXVyNDk3NzU2MTQ@._V1_SX300.jpg,Internet Movie Database,8.2/10,69.0,8.2,580796,tt0118715,movie,,,,,,,,,,,http://www.rottentomatoes.com/m/big_lebowski/,1998-10-27,,Gramercy Pictures,,True
166,The Sixth Sense,1999,PG-13,1999-08-06,107,Drama  Mystery  Thriller,M. Night Shyamalan,M. Night Shyamalan,Bruce Willis  Haley Joel Osment  Toni Collette  Olivia Williams,A boy who communicates with spirits that don't know they're dead seeks the help of a disheartened child psychologist.,English  Latin  Spanish,USA,Nominated for 6 Oscars. Another 32 wins & 47 nominations.,https://images-na.ssl-images-amazon.com/images/M/MV5BMWM4NTFhYjctNzUyNi00NGMwLTk3NTYtMDIyNTZmMzRlYmQyXkEyXkFqcGdeQXVyMTAwMzUyOTc@._V1_SX300.jpg,Internet Movie Database,8.1/10,64.0,8.1,754842,tt0167404,movie,,,,,,,,,,,http://www.rottentomatoes.com/m/sixth_sense/,2000-03-28,,Hollywood/Buena Vista,http://movies.go.com/moviesdynamic/movies/movie?id=505420,True
167,The Thing,1982,R,1982-06-25,109,Horror  Mystery  Sci-Fi,John Carpenter,Bill Lancaster (screenplay)  John W. Campbell Jr. (story),Kurt Russell  Wilford Brimley  T.K. Carter  David Clennon,A research facility in Antarctica comes across an alien force that can become anything it touches with 100% accuracy. The members must now find out who's human and who's not before it's too late.,English  Norwegian,USA,3 nominations.,https://images-na.ssl-images-amazon.com/images/M/MV5BNDcyZmFjY2YtN2I1OC00MzU3LWIzZGEtZDA5N2VlNDJjYWI3L2ltYWdlXkEyXkFqcGdeQXVyNTAyODkwOQ@@._V1_SX300.jpg,Internet Movie Database,8.2/10,57.0,8.2,281843,tt0084787,movie,,,,,,,,,,,http://www.rottentomatoes.com/m/1021244-thing/,2001-08-28,,Universal Pictures,http://www.theofficialjohncarpenter.com/pages/themovies/th/th.html,True
168,Finding Nemo,2003,G,2003-05-30,100,Animation  Adventure  Comedy,Andrew Stanton  Lee Unkrich,Andrew Stanton (original story by)  Andrew Stanton (screenplay)  Bob Peterson (screenplay)  David Reynolds (screenplay),Albert Brooks  Ellen DeGeneres  Alexander Gould  Willem Dafoe,After his son is captured in the Great Barrier Reef and taken to Sydney  a timid clownfish sets out on a journey to bring him home.,English,USA,Won 1 Oscar. Another 49 wins & 64 nominations.,https://images-na.ssl-images-amazon.com/images/M/MV5BZTAzNWZlNmUtZDEzYi00ZjA5LWIwYjEtZGM1NWE1MjE4YWRhXkEyXkFqcGdeQXVyNjU0OTQ0OTY@._V1_SX300.jpg,Internet Movie Database,8.1/10,90.0,8.1,756517,tt0266543,movie,,,,,,,,,,,http://www.rottentomatoes.com/m/finding_nemo/,2013-05-07,380529370.0,Walt Disney Pictures,http://disney.go.com/disneyvideos/animatedfilms/findingnemo/index2.html,True
