RowId,Title,Year,Rated,Released,Runtime,Genre,Director,Writer,Actors,Plot,Language,Country,Awards,Poster,Ratings.Source,Ratings.Value,Metascore,imdbRating,imdbVotes,imdbID,Type,tomatoMeter,tomatoImage,tomatoRating,tomatoReviews,tomatoFresh,tomatoRotten,tomatoConsensus,tomatoUserMeter,tomatoUserRating,tomatoUserReviews,tomatoURL,DVD,BoxOffice,Production,Website,Response
169,Tokyo Story,1953,NOT RATED,1972-03-13,136,Drama,Yasujirô Ozu,Kôgo Noda (scenario)  Yasujirô Ozu (scenario),Chishû Ryû  Chieko Higashiyama  Setsuko Hara  Haruko Sugimura,An old couple visit their children and grandchildren in the city; but the children have little time for them.,Japanese  English,Japan,3 wins.,https://images-na.ssl-images-amazon.com/images/M/MV5BYmUwN2VjZjAtZjg1Ny00OTk3LTg5MWYtMTA0OGM5Njk5NmQxXkEyXkFqcGdeQXVyNjU0OTQ0OTY@._V1_SX300.jpg,Internet Movie Database,8.2/10,,8.2,31364,tt0046438,movie,,,,,,,,,,,http://www.rottentomatoes.com/m/tokyo_story/,2003-10-30,,BFI Production,,True
170,No Country for Old Men,2007,R,2007-11-21,122,Crime  Drama  Thriller,Ethan Coen  Joel Coen,Joel Coen (screenplay)  Ethan Coen (screenplay)  Cormac McCarthy (novel),Tommy Lee Jones  Javier Bardem  Josh Brolin  Woody Harrelson,Violence and mayhem ensue after a hunter stumbles upon a drug deal gone wrong and more than two million dollars in cash near the Rio Grande.,English  Spanish,USA,Won 4 Oscars. Another 156 wins & 132 nominations.,https://images-na.ssl-images-amazon.com/images/M/MV5BMjA5Njk3MjM4OV5BMl5BanBnXkFtZTcwMTc5MTE1MQ@@._V1_SX300.jpg,Internet Movie Database,8.1/10,91.0,8.1,666081,tt0477348,movie,,,,,,,,,,,http://www.rottentomatoes.com/m/no_country_for_old_men/,2009-04-07,74223625.0,Miramax Films,http://www.nocountryforoldmen-themovie.com,True
171,Rang De Basanti,2006,NOT RATED,2006-01-26,157,Comedy  Drama  History,Rakeysh Omprakash Mehra,Renzil D'Silva (screenplay)  Prasoon Joshi (dialogue)  Rakeysh Omprakash Mehra (screenplay)  Kamlesh Pandey (story),Aamir Khan  Siddharth  Sharman Joshi  Kunal Kapoor,This story is about six friends who help an English filmmaker create a documentary about Indian freedom struggle. During filming  this group of friends learn about those before them and the importance of fighting for their rights.,Hindi  Panjabi  English,India,Nominated for 1 BAFTA Film Award. Another 17 wins & 19 nominations.,https://images-na.ssl-images-amazon.com/images/M/MV5BMjEwNzA5MjAwN15BMl5BanBnXkFtZTcwMzY5MzIzMQ@@._V1_SX300.jpg,Internet Movie Database,8.3/10,,8.3,81768,tt0405508,movie,,,,,,,,,,,http://www.rottentomatoes.com/m/fighting-corruption-at-every-level/,1998-01-01,,,,True
172,The Passion of Joan of Arc,1928,NOT RATED,2028-10-25,114,Biography  Drama  History,Carl Theodor Dreyer,Joseph Delteil  Carl Theodor Dreyer,Maria Falconetti  Eugene Silvain  André Berley  Maurice Schutz,A chronicle of the trial of Jeanne d'Arc on charges of heresy  and the efforts of her ecclesiastical jurists to force Jeanne to recant her claims of holy visions.,French,France,2 wins & 1 nomination.,https://images-na.ssl-images-amazon.com/images/M/MV5BZDM0NzdhMGItM2Y2Yy00MzM4LTgwY2YtYzQwYWQ5YzRiZDdhXkEyXkFqcGdeQXVyMTg2NTc4MzA@._V1_SX300.jpg,Internet Movie Database,8.3/10,,8.3,29440,tt0019254,movie,,,,,,,,,,,http://www.rottentomatoes.com/m/passion_of_joan_of_arc/,1999-11-09,,Criterion Collection,,True
173,Cool Hand Luke,1967,PG,2067-11-01,126,Crime  Drama,Stuart Rosenberg,Donn Pearce (screenplay)  Frank Pierson (screenplay)  Donn Pearce (novel),Paul Newman  George Kennedy  J.D. Cannon  Lou Antonio,A man refuses to conform to life in a rural prison.,English,USA,Won 1 Oscar. Another 3 wins & 9 nominations.,https://images-na.ssl-images-amazon.com/images/M/MV5BOWFlNzZhYmYtYTI5YS00MDQyLWIyNTUtNTRjMWUwNTEzNjA0XkEyXkFqcGdeQXVyNjUwNzk3NDc@._V1_SX300.jpg,Internet Movie Database,8.2/10,,8.2,128345,tt0061512,movie,,,,,,,,,,,http://www.rottentomatoes.com/m/cool_hand_luke/,1997-11-03,,Warner Bros.,,True
174,Rebecca,1940,APPROVED,2040-04-12,130,Drama  Mystery  Romance,Alfred Hitchcock,Daphne Du Maurier (celebrated novel)  Robert E. Sherwood (screen play)  Joan Harrison (screen play)  Philip MacDonald (adaptation)  Michael Hogan (adaptation),Laurence Olivier  Joan Fontaine  George Sanders  Judith Anderson,A self-conscious bride is tormented by the memory of her husband's dead first wife.,English  French,USA,Won 2 Oscars. Another 4 wins & 10 nominations.,https://images-na.ssl-images-amazon.com/images/M/MV5BYTcxYWExOTMtMWFmYy00ZjgzLWI0YjktNWEzYzJkZTg0NDdmL2ltYWdlXkEyXkFqcGdeQXVyNjc1NTYyMjg@._V1_SX300.jpg,Internet Movie Database,8.2/10,,8.2,94586,tt0032976,movie,,,,,,,,,,,http://www.rottentomatoes.com/m/1017293-rebecca/,2001-03-13,,United Artists,,True
175,A Wednesday,2008,NOT RATED,2008-09-05,104,Crime  Drama  Mystery,Neeraj Pandey,Neeraj Pandey (story)  Neeraj Pandey (script),Anupam Kher  Naseeruddin Shah  Jimmy Shergill  Deepal Shaw,A retiring police officer reminisces about the most astounding day of his career. About a case that was never filed but continues to haunt him in his memories - the case of a man and a Wednesday.,Hindi  English,India,7 wins & 20 nominations.,https://images-na.ssl-images-amazon.com/images/M/MV5BMTAzODEzMjE1MTJeQTJeQWpwZ15BbWU3MDE3NjQ5Mzk@._V1_SX300.jpg,Internet Movie Database,8.3/10,,8.3,52217,tt1280558,movie,,,,,,,,,,,http://www.rottentomatoes.com/m/a-wednesday/,2008-12-02,,UTV Communications,,True
176,There Will Be Blood,2007,R,2008-01-25,158,Drama  History,Paul Thomas Anderson,Paul Thomas Anderson (screenplay)  Upton Sinclair (novel),Daniel Day-Lewis  Martin Stringer  Matthew Braden Stringer  Jacob Stringer,A story of family  religion  hatred  oil and madness  focusing on a turn-of-the-century prospector in the early days of the business.,English  American Sign Language,USA,Won 2 Oscars. Another 106 wins & 135 nominations.,https://images-na.ssl-images-amazon.com/images/M/MV5BMjAxODQ4MDU5NV5BMl5BanBnXkFtZTcwMDU4MjU1MQ@@._V1_SX300.jpg,Internet Movie Database,8.1/10,92.0,8.1,402281,tt0469494,movie,,,,,,,,,,,http://www.rottentomatoes.com/m/there_will_be_blood/,2008-04-08,40133435.0,Paramount Vantage,http://www.therewillbeblood.com,True
177,How to Train Your Dragon,2010,PG,2010-03-26,98,Animation  Action  Adventure,Dean DeBlois  Chris Sanders,William Davies (screenplay)  Dean DeBlois (screenplay)  Chris Sanders (screenplay)  Cressida Cowell (book),Jay Baruchel  Gerard Butler  Craig Ferguson  America Ferrera,A hapless young Viking who aspires to hunt dragons becomes the unlikely friend of a young dragon himself  and learns there may be more to the creatures than he assumed.,English,USA,Nominated for 2 Oscars. Another 26 wins & 61 nominations.,https://images-na.ssl-images-amazon.com/images/M/MV5BMjA5NDQyMjc2NF5BMl5BanBnXkFtZTcwMjg5ODcyMw@@._V1_SX300.jpg,Internet Movie Database,8.1/10,74.0,8.1,528657,tt0892769,movie,,,,,,,,,,,http://www.rottentomatoes.com/m/1194522-how_to_train_your_dragon/,2010-10-15,216900000.0,Paramount/DWA,http://www.HowToTrainYourDragon.com/,True
178,Kill Bill: Vol. 1,2003,R,2003-10-10,111,Action  Crime  Thriller,Quentin Tarantino,Quentin Tarantino  Quentin Tarantino (character The Bride)  Uma Thurman (character The Bride),Uma Thurman  Lucy Liu  Vivica A. Fox  Daryl Hannah,The Bride wakens from a four-year coma. The child she carried in her womb is gone. Now she must wreak vengeance on the team of assassins who betrayed her - a team she was once part of.,English  Japanese  French,USA,Nominated for 1 Golden Globe. Another 27 wins & 99 nominations.,https://images-na.ssl-images-amazon.com/images/M/MV5BMTU1NDg1Mzg4M15BMl5BanBnXkFtZTYwMDExOTc3._V1_SX300.jpg,Internet Movie Database,8.1/10,69.0,8.1,791579,tt0266697,movie,,,,,,,,,,,http://www.rottentomatoes.com/m/kill_bill_vol_1/,2004-04-13,,Miramax Films,http://www.kill-bill.com/,True
179,Come and See,1985,NOT RATED,1985-10-17,142,Drama  War,Elem Klimov,Ales Adamovich (story)  Ales Adamovich (screenplay)  Elem Klimov (screenplay),Aleksey Kravchenko  Olga Mironova  Liubomiras Laucevicius  Vladas Bagdonas,After finding an old rifle  a young boy joins the Soviet resistance movement against ruthless German forces and experiences the horrors of World War II.,Belarusian  Russian  German,Soviet Union,2 wins.,https://images-na.ssl-images-amazon.com/images/M/MV5BY2E3NzNlZGYtMGNmMS00ZGUzLThiYWItYjk0MDQ4MmFlZmUzXkEyXkFqcGdeQXVyNTc2MDU0NDE@._V1_SX300.jpg,Internet Movie Database,8.3/10,,8.3,30443,tt0091251,movie,,,,,,,,,,,http://www.rottentomatoes.com/m/1036052-come_and_see/,2001-10-23,,Kino International,,True
180,Mary and Max,2009,NOT RATED,2009-04-09,92,Animation  Comedy  Drama,Adam Elliot,Adam Elliot,Toni Collette  Philip Seymour Hoffman  Barry Humphries  Eric Bana,A tale of friendship between two unlikely pen pals: Mary  a lonely  eight-year-old girl living in the suburbs of Melbourne  and Max  a forty-four-year old  severely obese man living in New York.,English  Yiddish,Australia,4 wins & 9 nominations.,https://images-na.ssl-images-amazon.com/images/M/MV5BMDgzYjQwMDMtNGUzYi00MTRmLWIyMGMtNjE1OGZkNzY2YWIzL2ltYWdlXkEyXkFqcGdeQXVyNjU0OTQ0OTY@._V1_SX300.jpg,Internet Movie Database,8.2/10,,8.2,129873,tt0978762,movie,,,,,,,,,,,http://www.rottentomatoes.com/m/1209767-mary_and_max/,2010-06-15,,IFC Films,http://www.maryandmax.com/,True
181,Gone Girl,2014,R,2014-10-03,149,Crime  Drama  Mystery,David Fincher,Gillian Flynn (screenplay)  Gillian Flynn (novel),Ben Affleck  Rosamund Pike  Neil Patrick Harris  Tyler Perry,With his wife's disappearance having become the focus of an intense media circus  a man sees the spotlight turned on him when it's suspected that he may not be innocent.,English,USA,Nominated for 1 Oscar. Another 64 wins & 176 nominations.,https://images-na.ssl-images-amazon.com/images/M/MV5BMTk0MDQ3MzAzOV5BMl5BanBnXkFtZTgwNzU1NzE3MjE@._V1_SX300.jpg,Internet Movie Database,8.1/10,79.0,8.1,640332,tt2267998,movie,,,,,,,,,,,http://www.rottentomatoes.com/m/gone_girl/,2015-01-13,,20th Century Fox,http://www.findamazingamy.com/,True
182,Into the Wild,2007,R,2007-10-19,148,Adventure  Biography  Drama,Sean Penn,Sean Penn (screenplay)  Jon Krakauer (book),Emile Hirsch  Marcia Gay Harden  William Hurt  Jena Malone,After graduating from Emory University  top student and athlete Christopher McCandless abandons his possessions  gives his entire $24 000 savings account to charity and hitchhikes to Alaska to live in the wilderness. Along the way  Christopher encounters a series of characters that shape his life.,English  Danish,USA,Nominated for 2 Oscars. Another 23 wins & 99 nominations.,https://images-na.ssl-images-amazon.com/images/M/MV5BMTAwNDEyODU1MjheQTJeQWpwZ15BbWU2MDc3NDQwNw@@._V1_SX300.jpg,Internet Movie Database,8.1/10,73.0,8.1,461312,tt0758758,movie,,,,,,,,,,,http://www.rottentomatoes.com/m/into_the_wild/,2008-03-04,18173360.0,Paramount Vantage,http://www.intothewild.com/,True
183,It Happened One Night,1934,UNRATED,2034-02-22,105,Comedy  Romance,Frank Capra,Robert Riskin (screen play)  Samuel Hopkins Adams (based on the short story by),Clark Gable  Claudette Colbert  Walter Connolly  Roscoe Karns,A spoiled heiress running away from her family is helped by a man who is actually a reporter in need of a story.,English,USA,Won 5 Oscars. Another 5 wins & 1 nomination.,https://images-na.ssl-images-amazon.com/images/M/MV5BZmViYmM5OTYtNGQ4Ny00YjQyLThiNjEtYTE4MGZhZTNmZjcyL2ltYWdlL2ltYWdlXkEyXkFqcGdeQXVyNjU0OTQ0OTY@._V1_SX300.jpg,Internet Movie Database,8.2/10,,8.2,70807,tt0025316,movie,,,,,,,,,,,http://www.rottentomatoes.com/m/it_happened_one_night/,1999-12-28,,Sony Pictures Home Entertainment,,True
184,Shutter Island,2010,R,2010-02-19,138,Mystery  Thriller,Martin Scorsese,Laeta Kalogridis (screenplay)  Dennis Lehane (novel),Leonardo DiCaprio  Mark Ruffalo  Ben Kingsley  Max von Sydow,In 1954  a U.S. marshal investigates the disappearance of a murderess who escaped from a hospital for the criminally insane.,English  German,USA,8 wins & 62 nominations.,https://images-na.ssl-images-amazon.com/images/M/MV5BY2NkNTcxNjAtODhjMS00Mjg2LWI1OGItMjRhMGJlODBkZTVlL2ltYWdlL2ltYWdlXkEyXkFqcGdeQXVyNzAxMjE1NDg@._V1_SX300.jpg,Internet Movie Database,8.1/10,63.0,8.1,862078,tt1130884,movie,,,,,,,,,,,http://www.rottentomatoes.com/m/1198124-shutter_island/,2010-06-08,125001000.0,Paramount Studios,http://www.shutterisland.com/,True
185,Life of Brian,1979,R,1979-08-17,94,Comedy,Terry Jones,Graham Chapman  John Cleese  Terry Gilliam  Eric Idle  Terry Jones  Michael Palin,Graham Chapman  John Cleese  Terry Gilliam  Eric Idle,Brian is born on the original Christmas  in the stable next door. He spends his life being mistaken for a messiah.,English  Latin,UK,,https://images-na.ssl-images-amazon.com/images/M/MV5BMzAwNjU1OTktYjY3Mi00NDY5LWFlZWUtZjhjNGE0OTkwZDkwXkEyXkFqcGdeQXVyMTQxNzMzNDI@._V1_SX300.jpg,Internet Movie Database,8.1/10,75.0,8.1,291865,tt0079470,movie,,,,,,,,,,,http://www.rottentomatoes.com/m/monty_pythons_life_of_brian/,1999-04-30,,Warner Bros. Pictures,http://www.pythonline.com,True
186,Platoon,1986,R,1987-02-06,120,Drama  War,Oliver Stone,Oliver Stone,Tom Berenger  Keith David  Willem Dafoe  Forest Whitaker,A young recruit in Vietnam faces a moral crisis when confronted with the horrors of war and the duality of man.,English  Vietnamese,UK  USA,Won 4 Oscars. Another 19 wins & 14 nominations.,https://images-na.ssl-images-amazon.com/images/M/MV5BZmJlOTE1ZTgtODdmNC00NmZhLThlZDYtNTllMmIyOTIwN2EwL2ltYWdlL2ltYWdlXkEyXkFqcGdeQXVyMTQxNzMzNDI@._V1_SX300.jpg,Internet Movie Database,8.1/10,92.0,8.1,311879,tt0091763,movie,,,,,,,,,,,http://www.rottentomatoes.com/m/platoon/,1997-12-09,,Orion Pictures,,True
187,Wild Tales,2014,R,2014-08-21,122,Comedy  Drama  Thriller,Damián Szifron,Damián Szifron,Darío Grandinetti  María Marull  Mónica Villa  Rita Cortese,Six short stories that explore the extremities of human behavior involving people in distress.,Spanish,Argentina  Spain,Nominated for 1 Oscar. Another 44 wins & 53 nominations.,https://images-na.ssl-images-amazon.com/images/M/MV5BNzAzMjA1ODAxOV5BMl5BanBnXkFtZTgwODg4NTQzNDE@._V1_SX300.jpg,Internet Movie Database,8.1/10,77.0,8.1,112743,tt3011894,movie,,,,,,,,,,,http://www.rottentomatoes.com/m/wild_tales/,2015-06-16,,Sony Pictures Classics,http://sonyclassics.com/wildtales/,True
188,Hotel Rwanda,2004,PG-13,2005-02-04,121,Biography  Drama  History,Terry George,Keir Pearson  Terry George,Don Cheadle  Xolani Mali  Desmond Dube  Hakeem Kae-Kazim,Paul Rusesabagina was a hotel manager who housed over a thousand Tutsi refugees during their struggle against the Hutu militia in Rwanda.,English  French,UK  South Africa  Italy,Nominated for 3 Oscars. Another 16 wins & 45 nominations.,https://images-na.ssl-images-amazon.com/images/M/MV5BMTI2MzQyNTc1M15BMl5BanBnXkFtZTYwMjExNjc3._V1_SX300.jpg,Internet Movie Database,8.1/10,79.0,8.1,282079,tt0395169,movie,,,,,,,,,,,http://www.rottentomatoes.com/m/hotel_rwanda/,2005-04-12,23472900.0,MGM,http://www.hotelrwanda.com/,True
189,Rush,2013,R,2013-09-27,123,Action  Biography  Drama,Ron Howard,Peter Morgan,Chris Hemsworth  Daniel Brühl  Olivia Wilde  Alexandra Maria Lara,The merciless 1970s rivalry between Formula One rivals James Hunt and Niki Lauda.,English  German  Italian  French  Spanish,UK  Germany  USA,Nominated for 2 Golden Globes. Another 6 wins & 62 nominations.,https://images-na.ssl-images-amazon.com/images/M/MV5BOWEwODJmZDItYTNmZC00OGM4LThlNDktOTQzZjIzMGQxODA4XkEyXkFqcGdeQXVyNjU0OTQ0OTY@._V1_SX300.jpg,Internet Movie Database,8.1/10,75.0,8.1,341336,tt1979320,movie,,,,,,,,,,,http://www.rottentomatoes.com/m/rush_2013/,2014-01-28,22442876.0,Universal Pictures,http://www.rushmovie.com/,True
190,The Wages of Fear,1953,NOT RATED,2055-02-16,131,Adventure  Drama  Thriller,Henri-Georges Clouzot,Georges Arnaud (novel)  Henri-Georges Clouzot (adaptation)  Jérôme Géronimi (adaptation),Yves Montand  Charles Vanel  Folco Lulli  Peter van Eyck,In a decrepit South American village  four men are hired to transport an urgent nitroglycerine shipment without the equipment that would make it safe.,French  English  Spanish  German  Italian  Russian,France  Italy,Won 1 BAFTA Film Award. Another 5 wins.,https://images-na.ssl-images-amazon.com/images/M/MV5BMTQ5MzkyNDgyMF5BMl5BanBnXkFtZTgwODg2MTMzMjE@._V1_SX300.jpg,Internet Movie Database,8.2/10,,8.2,38646,tt0046268,movie,,,,,,,,,,,http://www.rottentomatoes.com/m/wages_of_fear/,1999-01-26,,Janus Films,,True
191,Network,1976,R,1976-11-27,121,Drama,Sidney Lumet,Paddy Chayefsky,Faye Dunaway  William Holden  Peter Finch  Robert Duvall,A television network cynically exploits a deranged former anchor's ravings and revelations about the news media for its own profit.,English,USA,Won 4 Oscars. Another 15 wins & 25 nominations.,https://images-na.ssl-images-amazon.com/images/M/MV5BYTc3NjcyYmYtMTI4OC00OGViLTkwYzQtZWU2MGMwMTI5ZTU4XkEyXkFqcGdeQXVyNTc1NTQxODI@._V1_SX300.jpg,Internet Movie Database,8.1/10,88.0,8.1,111892,tt0074958,movie,,,,,,,,,,,http://www.rottentomatoes.com/m/network/,2000-05-16,,MGM/United Artists,,True
192,In the Name of the Father,1993,R,1994-02-25,133,Biography  Drama,Jim Sheridan,"Gerry Conlon (autobiographical book ""Proved Innocent"")  Terry George (screenplay)  Jim Sheridan (screenplay)",Alison Crosbie  Daniel Day-Lewis  Philip King  Emma Thompson,A man's coerced confession to an IRA bombing he did not commit results in the imprisonment of his father as well. An English lawyer fights to free them.,English,Ireland  UK  USA,Nominated for 7 Oscars. Another 7 wins & 21 nominations.,https://images-na.ssl-images-amazon.com/images/M/MV5BMWQ0ZGU3NDUtYjRkNS00Yzg4LTgxMTItMjExYjg3ZjgyMGRkXkEyXkFqcGdeQXVyNjU0OTQ0OTY@._V1_SX300.jpg,Internet Movie Database,8.1/10,84.0,8.1,119905,tt0107207,movie,,,,,,,,,,,http://www.rottentomatoes.com/m/in_the_name_of_the_father/,1998-07-07,,Universal Pictures,,True
193,Stand by Me,1986,R,1986-08-22,89,Adventure  Drama,Rob Reiner,Stephen King (novel)  Raynold Gideon (screenplay)  Bruce A. Evans (screenplay),Wil Wheaton  River Phoenix  Corey Feldman  Jerry O'Connell,After the death of a friend  a writer recounts a boyhood journey to find the body of a missing boy.,English,USA,Nominated for 1 Oscar. Another 4 wins & 11 nominations.,https://images-na.ssl-images-amazon.com/images/M/MV5BMjIxODliZDYtMGMyYy00ZDQzLTgzOTMtMWY5YWEyNTBhNzk5L2ltYWdlL2ltYWdlXkEyXkFqcGdeQXVyMTQxNzMzNDI@._V1_SX300.jpg,Internet Movie Database,8.1/10,75.0,8.1,292157,tt0092005,movie,,,,,,,,,,,http://www.rottentomatoes.com/m/stand_by_me_1986/,2000-08-29,,MCA Universal Home Video,,True
194,The 400 Blows,1959,NOT RATED,2059-11-16,99,Crime  Drama,François Truffaut,François Truffaut (scenario)  Marcel Moussy (adaptation)  François Truffaut (adaptation)  Marcel Moussy (dialogue),Jean-Pierre Léaud  Claire Maurier  Albert Rémy  Guy Decomble,Moving story of a young boy who  left without attention  delves into a life of petty crime.,French  English,France,Nominated for 1 Oscar. Another 7 wins & 3 nominations.,https://images-na.ssl-images-amazon.com/images/M/MV5BYTQ4MjA4NmYtYjRhNi00MTEwLTg0NjgtNjk3ODJlZGU4NjRkL2ltYWdlL2ltYWdlXkEyXkFqcGdeQXVyNjU0OTQ0OTY@._V1_SX300.jpg,Internet Movie Database,8.1/10,,8.1,76599,tt0053198,movie,,,,,,,,,,,http://www.rottentomatoes.com/m/400_blows/,1998-03-24,,Zenith International Films,,True
195,Ben-Hur,1959,G,2060-01-29,212,Adventure  Drama  History,William Wyler,Lew Wallace (novel)  Karl Tunberg (screenplay),Charlton Heston  Jack Hawkins  Haya Harareet  Stephen Boyd,When a Jewish prince is betrayed and sent into slavery by a Roman friend  he regains his freedom and comes back for revenge.,English,USA,Won 11 Oscars. Another 16 wins & 13 nominations.,https://images-na.ssl-images-amazon.com/images/M/MV5BNjgxY2JiZDYtZmMwOC00ZmJjLWJmODUtMTNmNWNmYWI5ODkwL2ltYWdlL2ltYWdlXkEyXkFqcGdeQXVyNjc1NTYyMjg@._V1_SX300.jpg,Internet Movie Database,8.1/10,90.0,8.1,175529,tt0052618,movie,,,,,,,,,,,http://www.rottentomatoes.com/m/benhur/,2005-09-13,,MGM,,True
196,The Grand Budapest Hotel,2014,R,2014-03-28,99,Adventure  Comedy  Drama,Wes Anderson,Stefan Zweig (inspired by the writings of)  Wes Anderson (screenplay)  Wes Anderson (story)  Hugo Guinness (story),Ralph Fiennes  F. Murray Abraham  Mathieu Amalric  Adrien Brody,The adventures of Gustave H  a legendary concierge at a famous hotel from the fictional Republic of Zubrowka between the first and second World Wars  and Zero Moustafa  the lobby boy who becomes his most trusted friend.,English  French,USA  Germany,Won 4 Oscars. Another 127 wins & 217 nominations.,https://images-na.ssl-images-amazon.com/images/M/MV5BMzM5NjUxOTEyMl5BMl5BanBnXkFtZTgwNjEyMDM0MDE@._V1_SX300.jpg,Internet Movie Database,8.1/10,88.0,8.1,537323,tt2278388,movie,,,,,,,,,,,http://www.rottentomatoes.com/m/the_grand_budapest_hotel/,2014-06-17,56939515.0,Fox Searchlight,http://www.grandbudapesthotel.com/,True
197,Spotlight,2015,R,2015-11-20,128,Crime  Drama  History,Tom McCarthy,Josh Singer  Tom McCarthy,Mark Ruffalo  Michael Keaton  Rachel McAdams  Liev Schreiber,The true story of how the Boston Globe uncovered the massive scandal of child molestation and cover-up within the local Catholic Archdiocese  shaking the entire Catholic Church to its core.,English,USA  Canada,Won 2 Oscars. Another 115 wins & 134 nominations.,https://images-na.ssl-images-amazon.com/images/M/MV5BMjIyOTM5OTIzNV5BMl5BanBnXkFtZTgwMDkzODE2NjE@._V1_SX300.jpg,Internet Movie Database,8.1/10,93.0,8.1,274216,tt1895587,movie,,,,,,,,,,,http://www.rottentomatoes.com/m/untitled_boston_globe_project/,2016-02-23,,Open Road Films,http://SpotlightTheFilm.com,True
198,Mad Max: Fury Road,2015,R,2015-05-15,120,Action  Adventure  Sci-Fi,George Miller,George Miller  Brendan McCarthy  Nick Lathouris,Tom Hardy  Charlize Theron  Nicholas Hoult  Hugh Keays-Byrne,A woman rebels against a tyrannical ruler in postapocalyptic Australia in search for her home-land with the help of a group of female prisoners  a psychotic worshipper  and a drifter named Max.,English  Russian,Australia  USA,Won 6 Oscars. Another 231 wins & 208 nominations.,https://images-na.ssl-images-amazon.com/images/M/MV5BMTUyMTE0ODcxNF5BMl5BanBnXkFtZTgwODE4NDQzNTE@._V1_SX300.jpg,Internet Movie Database,8.1/10,90.0,8.1,638510,tt1392190,movie,,,,,,,,,,,http://www.rottentomatoes.com/m/mad_max_fury_road/,2015-09-01,129483877.0,Warner Bros.,http://www.madmaxmovie.com/,True
199,12 Years a Slave,2013,R,2013-11-08,134,Biography  Drama  History,Steve McQueen,"John Ridley (screenplay)  Solomon Northup (based on ""Twelve Years a Slave"" by)",Chiwetel Ejiofor  Dwight Henry  Dickie Gravois  Bryan Batt,In the antebellum United States  Solomon Northup  a free black man from upstate New York  is abducted and sold into slavery.,English,USA  UK,Won 3 Oscars. Another 235 wins & 326 nominations.,https://images-na.ssl-images-amazon.com/images/M/MV5BMjExMTEzODkyN15BMl5BanBnXkFtZTcwNTU4NTc4OQ@@._V1_SX300.jpg,Internet Movie Database,8.1/10,96.0,8.1,490387,tt2024544,movie,,,,,,,,,,,http://www.rottentomatoes.com/m/12_years_a_slave/,2014-03-04,50628650.0,Fox Searchlight,http://www.foxsearchlight.com/12yearsaslave/,True
200,Persona,1966,NOT RATED,2067-03-16,83,Drama  Thriller,Ingmar Bergman,Ingmar Bergman (story and screenplay),Bibi Andersson  Liv Ullmann  Margaretha Krook  Gunnar Björnstrand,A nurse is put in charge of a mute actress and finds that their personas are melding together.,Swedish  English,Sweden,Nominated for 1 BAFTA Film Award. Another 6 wins & 3 nominations.,https://images-na.ssl-images-amazon.com/images/M/MV5BMTc1OTgxNjYyNF5BMl5BanBnXkFtZTcwNjM2MjM2NQ@@._V1_SX300.jpg,Internet Movie Database,8.1/10,,8.1,68948,tt0060827,movie,,,,,,,,,,,http://www.rottentomatoes.com/m/persona/,2004-03-16,,Criterion Collection,,True
201,Million Dollar Baby,2004,PG-13,2005-01-28,132,Drama  Sport,Clint Eastwood,Paul Haggis (screenplay)  F.X. Toole (stories),Clint Eastwood  Hilary Swank  Morgan Freeman  Jay Baruchel,A determined woman works with a hardened boxing trainer to become a professional.,English  Irish,USA,Won 4 Oscars. Another 63 wins & 83 nominations.,https://images-na.ssl-images-amazon.com/images/M/MV5BMTkxNzA1NDQxOV5BMl5BanBnXkFtZTcwNTkyMTIzMw@@._V1_SX300.jpg,Internet Movie Database,8.1/10,86.0,8.1,519405,tt0405159,movie,,,,,,,,,,,http://www.rottentomatoes.com/m/million_dollar_baby/,2005-07-12,100422786.0,Warner Bros. Pictures,http://milliondollarbabymovie.warnerbros.com/,True
202,Butch Cassidy and the Sundance Kid,1969,PG,1969-10-24,110,Biography  Crime  Drama,George Roy Hill,William Goldman,Paul Newman  Robert Redford  Katharine Ross  Strother Martin,Two Western bank/train robbers flee to Bolivia when the law gets too close.,English  Spanish,USA,Won 4 Oscars. Another 16 wins & 14 nominations.,https://images-na.ssl-images-amazon.com/images/M/MV5BMTkyMTM2NDk5Nl5BMl5BanBnXkFtZTgwNzY1NzEyMDE@._V1_SX300.jpg,Internet Movie Database,8.1/10,58.0,8.1,163664,tt0064115,movie,,,,,,,,,,,http://www.rottentomatoes.com/m/1003318-butch_cassidy_and_the_sundance_kid/,2000-05-16,,20th Century Fox,,True
203,Jurassic Park,1993,PG-13,1993-06-11,127,Adventure  Sci-Fi  Thriller,Steven Spielberg,Michael Crichton (novel)  Michael Crichton (screenplay)  David Koepp (screenplay),Sam Neill  Laura Dern  Jeff Goldblum  Richard Attenborough,During a preview tour  a theme park suffers a major power breakdown that allows its cloned dinosaur exhibits to run amok.,English  Spanish,USA,Won 3 Oscars. Another 28 wins & 17 nominations.,https://images-na.ssl-images-amazon.com/images/M/MV5BMjM2MDgxMDg0Nl5BMl5BanBnXkFtZTgwNTM2OTM5NDE@._V1_SX300.jpg,Internet Movie Database,8.1/10,68.0,8.1,670652,tt0107290,movie,,,,,,,,,,,http://www.rottentomatoes.com/m/jurassic_park/,2000-10-10,45299680.0,Universal City Studios,http://www.jurassicpark.com/maingate_flash.html,True
